{
  "contractVersion": "1.0.0",
  "dependsOn": [],
  "domain": {
    "contractVersion": "1.0.0",
    "extensions": [
      {
        "kind": "building-element-taxonomy",
        "ref": "aise-building-elements",
        "version": "1.0.0"
      }
    ],
    "operationVocabulary": "aise-building-operations-v1",
    "vertical": "building"
  },
  "intentId": "intent-demo-0010",
  "operationType": "demolition-removal",
  "parameters": [
    {
      "name": "length",
      "unit": "m",
      "value": 5
    },
    {
      "name": "height",
      "unit": "m",
      "value": 2.4
    },
    {
      "name": "thickness",
      "unit": "m",
      "value": 0.1
    }
  ],
  "proposedTo": {
    "solutionId": "solution-demo-001",
    "versionNumber": 1
  },
  "provenance": {
    "authoredAt": "2026-09-16T09:00:00.000Z",
    "authoredBy": "user-demo-engineer",
    "derivationNote": "operator removed the damaged plaster and wall section by direct selection",
    "evidenceIds": [],
    "interactionDetail": "operator selected the damaged wall faces and invoked remove",
    "origin": "direct-manipulation"
  },
  "target": {
    "contractVersion": "1.0.0",
    "description": "The affected ground-floor wall faces",
    "geometryRefs": [
      {
        "kind": "polygon",
        "ref": "geo-wall-faces-002"
      }
    ],
    "nodeRefs": [
      "node-wall-002"
    ],
    "selectorKind": "face-set",
    "units": {
      "angular": "rad",
      "linear": "m"
    }
  }
}
