{
  "contractVersion": "1.0.0",
  "dependsOn": [],
  "domain": {
    "contractVersion": "1.0.0",
    "extensions": [
      {
        "kind": "building-element-taxonomy",
        "ref": "aise-building-elements",
        "version": "1.0.0"
      }
    ],
    "operationVocabulary": "aise-building-operations-v1",
    "vertical": "building"
  },
  "intentId": "intent-demo-0023",
  "operationType": "opening-creation",
  "parameters": [
    {
      "name": "width",
      "unit": "m",
      "value": 0.9
    },
    {
      "name": "height",
      "unit": "m",
      "value": 2.1
    },
    {
      "name": "material",
      "value": "timber-frame"
    }
  ],
  "provenance": {
    "authoredAt": "2026-09-16T09:00:00.000Z",
    "authoredBy": "user-demo-engineer",
    "derivationNote": "operator placed the opening on the selected wall element",
    "evidenceIds": [],
    "origin": "direct-manipulation"
  },
  "target": {
    "contractVersion": "1.0.0",
    "description": "The wall element receiving the new opening",
    "geometryRefs": [],
    "nodeRefs": [
      "node-wall-002"
    ],
    "selectorKind": "element",
    "units": {
      "angular": "rad",
      "linear": "m"
    }
  }
}
