{
  "contractVersion": "1.0.0",
  "dependsOn": [],
  "domain": {
    "contractVersion": "1.0.0",
    "extensions": [
      {
        "kind": "building-element-taxonomy",
        "ref": "aise-building-elements",
        "version": "1.0.0"
      }
    ],
    "operationVocabulary": "aise-building-operations-v1",
    "vertical": "building"
  },
  "intentId": "intent-demo-0011",
  "operationType": "block-wall-placement",
  "parameters": [
    {
      "name": "length",
      "unit": "m",
      "value": 5
    },
    {
      "name": "height",
      "unit": "m",
      "value": 1
    },
    {
      "name": "thickness",
      "unit": "m",
      "value": 0.1
    },
    {
      "name": "material",
      "value": "concrete-block"
    }
  ],
  "proposedTo": {
    "solutionId": "solution-demo-001",
    "versionNumber": 1
  },
  "provenance": {
    "authoredAt": "2026-09-16T09:10:00.000Z",
    "authoredBy": "agent-demo-assistant",
    "commandText": "Lay blocks to a height of 1 m along this wall.",
    "evidenceIds": [],
    "origin": "agent"
  },
  "target": {
    "contractVersion": "1.0.0",
    "description": "The wall line along the damaged section",
    "geometryRefs": [
      {
        "kind": "plane",
        "ref": "geo-wall-line-003"
      }
    ],
    "nodeRefs": [
      "node-wall-002"
    ],
    "selectorKind": "line-extent",
    "units": {
      "angular": "rad",
      "linear": "m"
    }
  }
}
