{
  "contractVersion": "1.0.0",
  "dependsOn": [],
  "domain": {
    "contractVersion": "1.0.0",
    "extensions": [],
    "operationVocabulary": "aise-mep-operations-v1",
    "vertical": "mep"
  },
  "intentId": "intent-demo-0030",
  "operationType": "conduit-run",
  "parameters": [
    {
      "name": "length",
      "unit": "m",
      "value": 8
    },
    {
      "name": "diameter",
      "unit": "mm",
      "value": 20
    }
  ],
  "provenance": {
    "authoredAt": "2026-09-16T09:20:00.000Z",
    "authoredBy": "agent-demo-assistant",
    "commandText": "Run a 20 mm conduit along the wall for 8 m.",
    "evidenceIds": [],
    "origin": "agent"
  },
  "target": {
    "contractVersion": "1.0.0",
    "description": "The wall line along the damaged section",
    "geometryRefs": [
      {
        "kind": "plane",
        "ref": "geo-wall-line-003"
      }
    ],
    "nodeRefs": [
      "node-wall-002"
    ],
    "selectorKind": "line-extent",
    "units": {
      "angular": "rad",
      "linear": "m"
    }
  }
}
