{
  "contractVersion": "1.0.0",
  "dependsOn": [],
  "domain": {
    "contractVersion": "1.0.0",
    "extensions": [
      {
        "kind": "building-element-taxonomy",
        "ref": "aise-building-elements",
        "version": "1.0.0"
      }
    ],
    "operationVocabulary": "aise-building-operations-v1",
    "vertical": "building"
  },
  "intentId": "intent-demo-0031",
  "operationType": "trench-shoring",
  "parameters": [
    {
      "name": "depth",
      "unit": "m",
      "value": 1.5
    }
  ],
  "provenance": {
    "authoredAt": "2026-09-16T09:25:00.000Z",
    "authoredBy": "agent-demo-assistant",
    "commandText": "Shore the trench sides of the excavation.",
    "evidenceIds": [],
    "origin": "agent"
  },
  "target": {
    "contractVersion": "1.0.0",
    "description": "The pit excavation area south of the building footprint",
    "geometryRefs": [
      {
        "kind": "polygon",
        "ref": "geo-pit-outline-001"
      }
    ],
    "nodeRefs": [
      "node-site-001"
    ],
    "selectorKind": "volume",
    "units": {
      "angular": "rad",
      "linear": "m"
    }
  }
}
