{
  "contractVersion": "1.0.0",
  "dependsOn": [],
  "domain": {
    "contractVersion": "1.0.0",
    "extensions": [
      {
        "kind": "building-element-taxonomy",
        "ref": "aise-building-elements",
        "version": "1.0.0"
      }
    ],
    "operationVocabulary": "aise-building-operations-v1",
    "vertical": "building"
  },
  "intentId": "intent-demo-0025",
  "operationType": "finish-application",
  "parameters": [
    {
      "name": "thickness",
      "unit": "mm",
      "value": 2
    },
    {
      "name": "material",
      "value": "acrylic-paint"
    }
  ],
  "provenance": {
    "authoredAt": "2026-09-16T09:00:00.000Z",
    "authoredBy": "user-demo-engineer",
    "derivationNote": "operator applied the finish coat to the reinstated wall faces",
    "evidenceIds": [],
    "origin": "direct-manipulation"
  },
  "target": {
    "contractVersion": "1.0.0",
    "description": "The affected ground-floor wall faces",
    "geometryRefs": [
      {
        "kind": "polygon",
        "ref": "geo-wall-faces-002"
      }
    ],
    "nodeRefs": [
      "node-wall-002"
    ],
    "selectorKind": "face-set",
    "units": {
      "angular": "rad",
      "linear": "m"
    }
  }
}
