{
  "contractVersion": "1.0.0",
  "dependsOn": [],
  "domain": {
    "contractVersion": "1.0.0",
    "extensions": [
      {
        "kind": "building-element-taxonomy",
        "ref": "aise-building-elements",
        "version": "1.0.0"
      }
    ],
    "operationVocabulary": "aise-building-operations-v1",
    "vertical": "building"
  },
  "intentId": "intent-demo-0022",
  "operationType": "slab-placement",
  "parameters": [
    {
      "name": "length",
      "unit": "m",
      "value": 4
    },
    {
      "name": "width",
      "unit": "m",
      "value": 3
    },
    {
      "name": "thickness",
      "unit": "m",
      "value": 0.15
    },
    {
      "name": "material",
      "value": "reinforced-concrete"
    }
  ],
  "provenance": {
    "authoredAt": "2026-09-16T09:00:00.000Z",
    "authoredBy": "user-demo-engineer",
    "derivationNote": "operator dimensioned the slab region over the pit footprint",
    "evidenceIds": [],
    "origin": "direct-manipulation"
  },
  "target": {
    "contractVersion": "1.0.0",
    "description": "The ground-bearing slab region inside the excavated pit",
    "geometryRefs": [
      {
        "kind": "polygon",
        "ref": "geo-slab-region-005"
      }
    ],
    "nodeRefs": [
      "node-site-001"
    ],
    "selectorKind": "surface-region",
    "units": {
      "angular": "rad",
      "linear": "m"
    }
  }
}
